{
  "$schema": "token",
  "categories": ["Curve LP Tokens"],
  "description": "This token represents a Curve liquidity pool. Holders earn fees from users trading in the pool, and can also deposit the LP to Curve's gauges to earn CRV emissions. This factory metapool contains 3Crv (DAI, USDC, and USDT) and Liquity USD, a synthetic USD stablecoin collateralized with Ether.",
  "website": "https://www.curve.fi/",
  "tokenSymbolOverride": "crvLUSD",
  "tokenNameOverride": "Curve LUSD Pool"
}
