{
  "$schema": "token",
  "categories": ["Curve LP Tokens"],
  "description": "This token represents a Curve liquidity pool. Holders earn fees from users trading in the pool, and can also deposit the LP to Curve's gauges to earn CRV emissions. This metapool contains sBTC-Crv (sBTC, WBTC, and renBTC) and oBTC, an ERC-20 backed by native BTC via BoringDAO.",
  "website": "https://www.curve.fi/",
  "tokenSymbolOverride": "crvOBTC",
  "tokenNameOverride": "Curve oBTC Pool"
}
